"Preparing for Life in a Digital World","","","","","10.1007/978-3-030-38781-5","Julian FraillonDr. John AinleyWolfram SchulzTim FriedmanDaniel Duckworth","2020","http://link.springer.com/book/10.1007/978-3-030-38781-5","Book"
"Empowering Teachers to Build a Better World","SpringerBriefs in Education","","","","10.1007/978-981-15-2137-9","Fernando M. Reimers","2020","http://link.springer.com/book/10.1007/978-981-15-2137-9","Book"
"Attitudes, Beliefs, Motivation and Identity in Mathematics Education","ICME-13 Topical Surveys","","","","10.1007/978-3-319-32811-9","Markku S. HannulaPietro Di MartinoMarilena PantziaraQiaoping ZhangFrancesca MorselliEinat Heyd-MetzuyanimSonja LutovacRaimo KaasilaJames A. MiddletonAmanda JansenGerald A Goldin","2016","http://link.springer.com/book/10.1007/978-3-319-32811-9","Book"
"Bridging Educational Leadership, Curriculum Theory and Didaktik","Educational Governance Research","","","","10.1007/978-3-319-58650-2","Michael UljensRose M. Ylimaki","2017","http://link.springer.com/book/10.1007/978-3-319-58650-2","Book"
"The Troika of Adult Learners, Lifelong Learning, and Mathematics","ICME-13 Topical Surveys","","","","10.1007/978-3-319-32808-9","Katherine Safford-RamusPradeep Kumar MisraTerry Maguire","2016","http://link.springer.com/book/10.1007/978-3-319-32808-9","Book"
"Skills Development for Inclusive and Sustainable Growth in Developing Asia-Pacific","Technical and Vocational Education and Training: Issues, Concerns and Prospects","","","","10.1007/978-94-007-5937-4","Rupert MacleanShanti JagannathanJouko Sarvi","2013","http://link.springer.com/book/10.1007/978-94-007-5937-4","Book"
"School Leadership and Educational Change in Singapore","Springer Texts in Education","","","","10.1007/978-3-319-74746-0","Benjamin WongSalleh HaironPak Tee Ng","2019","http://link.springer.com/book/10.1007/978-3-319-74746-0","Book"
"Educational Technology","Lecture Notes in Educational Technology","","","","10.1007/978-981-13-6643-7","Ronghuai HuangJ. Michael SpectorJunfeng Yang","2019","http://link.springer.com/book/10.1007/978-981-13-6643-7","Book"
"Research Methods for Social Justice and Equity in Education","","","","","10.1007/978-3-030-05900-2","Dr. Kamden K. StrunkProf. Leslie Ann Locke","2019","http://link.springer.com/book/10.1007/978-3-030-05900-2","Book"
"Conferencing and Presentation English for Young Academics","Springer Texts in Education","","","","10.1007/978-981-13-2475-8","Michael Guest","2018","http://link.springer.com/book/10.1007/978-981-13-2475-8","Book"
"Grammar for Teachers","Springer Texts in Education","","","","10.1007/978-3-319-33916-0","Andrea DeCapua","2017","http://link.springer.com/book/10.1007/978-3-319-33916-0","Book"
"The Action Research Planner","","","","","10.1007/978-981-4560-67-2","Stephen KemmisRobin McTaggartRhonda Nixon","2014","http://link.springer.com/book/10.1007/978-981-4560-67-2","Book"
"A Course in Rasch Measurement Theory","Springer Texts in Education","","","","10.1007/978-981-13-7496-8","Prof. David AndrichIda Marais","2019","http://link.springer.com/book/10.1007/978-981-13-7496-8","Book"
"The A-Z of the PhD Trajectory","Springer Texts in Education","","","","10.1007/978-3-319-77425-1","Eva O. L. Lantsoght","2018","http://link.springer.com/book/10.1007/978-3-319-77425-1","Book"
"Writing for Publication","Springer Texts in Education","","","","10.1007/978-3-319-31650-5","Mary Renck JalongoOlivia N. Saracho","2016","http://link.springer.com/book/10.1007/978-3-319-31650-5","Book"
"Language Across the Curriculum & CLIL in English as an Additional Language (EAL) Contexts","","","","","10.1007/978-981-10-1802-2","Angel M.Y. Lin","2016","http://link.springer.com/book/10.1007/978-981-10-1802-2","Book"